file	beg	end	text	speaker	section
Fiedler_Layton_Ginsberg_DeLoach_Complete-Recording_Allentown-Community-Center-Buffalo_10-06-78	8.762	403.619	I'm going to read just one poem for my second time around. It's a long poem, which is to say a long poem for me, a longish poem. For a long time what I wanted to do more than anything else was to get poems shorter and shorter and shorter and then I discovered I was too successful. I stopped writing completely. Ach And silence was great, but I wasn't happy with it. This is the newest poem I have written It's= uh it's a poem which I wrestled with for a long time and put away untouched, and then I was asked very recently if I would contribute to a book intended primarily for children And this sent me back to this poem again which is a fairy tale poem Those of you who know me at all know that one of the overwhelming interests of my life is fairy tales and for many years, I tried to turn my favorite horrific fairy tale, which is called the Juniper Tree into verse, I was totally unsuccessful at doing this And I've ended up doing a b- # a= a fairy from an altogether different tradition I'm happy that I have some Japanese friends in the audience tonight because this poem is in fact a poem based on an old Japanese fairy tale which is called Momotaro or the Peach Boy I don't know whether any of you here know it or many of you here know it but it is a poem which always deeply moved me. Once many years ago, I was set to learning Japanese under the auspices of the United States Navy, as a matter of fact, and the only thing I read of all the material that we went through in the process of learning Japanese that ever stayed in my head was this story. I could still hear it going in my head for instance The noise that the peach out of which the little boy comes makes as it turns over and over in the river, donburi, donburi, donburi. I can hear the boy's mother talking to him as she loads him up with kibi dango millet seed cakes, the best kibi dango in all Japan, and I can hear the animals who stopped him, I've forgotten all the military Japanese I ever knew. I can't tell you the word for a battleship or a gun or an ((emplacement)) or anything else but I can t- # probably tell you this story in Japanese though all the rest of it is departed from me. And I'd wanted to work it and rework it, and I've tried= tried to find a form for it. And it finally occurred to me as I under- # with this ((sic-)) # you see it's= a= it's a long # it's only one poem I'm going to read so I have an excuse for a long introduction, right? uh As I thought about the ((uh)) appropriate form for this poem, I decided I would return to a very ancient and honorable form, very flexible and very beautiful doggerel This is a poem which is written in doggerel. I dearly love a rhyme, I'll do anything in the world for a rhyme and I don't much care how fast or how slow I get to it in the line. The interesting thing which happened to this story which originally had a happy ending Peach Boy goes out and he goes to the Onigashima, the island of the devils, and he conquers the king of the demons, devils, whatever you call them, monsters and he comes back home makes his family happy and he lives happily ever after. But as I wrote this poem, I discovered that the ending of it insisted on changing and I couldn't finish it until I changed the ending And this finally turned out then to be a poem not only about what I always thought it was about, which is the impossibility of finding a proper name for everything, anything, this is a poem about naming. But it also turned out to be a poem about heroism, an antiheroic poem And I suppose the reason it became an antiheroic poem is because the language which I learned reading the story of the little Peach Boy, I ended up using on the island of Iwo Jima and too many bad connotations are connected with it. Anyhow, I think all children always know that the so called happy endings of fairy tales are lies. Right? But they understand that we're courteous enough to lie to them and pretend that we think they believe in us when we tell them that everybody lived happily ever after. You'll see nobody lives happily ever after in this. ((It's)) divided into sections which are the parts of the story. The first part of Momotaro or the Peach Boy then is called The Finding of the Peach An old woodchopper and his old, old wife lived in the forest for all of their life, and the name of the chopper was Chopper. And the name of his wife was Wife and the name of the days they lived was Day and the name of the nights was Night But the name of the sum of them all was Pain for they had borne no child to bear their name Until crouched one day by the bank of the stream washing her wash and dreaming her dream, the old woman saw a giant peach afloat on the water just out of her reach Over and over it turned and the sun singing a song or humming a hum, donburi donburi reach out your hand, what is borne in the water may live on the land, what begins as a peach may end as a man, so wet your feet and catch what you can Like a child, she clutched it, clutched at the peach, something to fondle or something to eat like a child she held it tight to her breast but knowing no names how should ((she+)) guess what to call it or what would come next. Peach, she called it carrying it home to where the old man waited alone Part two is called The Cutting of the Peach. I'll cut it, said the old man since cutting was his trade Let's eat what luck has brought us, why should we be afraid? But his wife was lost in wonder and talk, though not her trade was what she did when she was not hanging in a glade their wash or the wash of others or mending what was frayed Hold off, she cried, or let me who've held it to my breast draw the knife across its skin, as soft as a caress	Subject	
Foster-Tonya_Complete-Reading_Segue-Zinc-Bar_2-23-13	0.381	421.25	Unmet desire stalks the bed and cupboard Desire, thick brambles She stares into her ~TV's two ~AM glares, watches the way she once watched a boy's body, too quick for caution and traffic signs ((parse)) asphalt Neighborhood boy, corner boy, man to be, Ben bones done and gone What light is good on that to want and not ask {lipsmack} in somniloquies Earthworms are maggots Eating them ain't planting a tree or a flag She wants to shout at her ~TV when some Sue gulps earthworms from a cup She wants to shout at this idea that there's payback for what's done, to come Earthworms aren't decomposers nor distraction from street corner noise You think a woman would know this, she thinks (({NSV})) This thought, a squirrel on a lawn You think a woman There are thoughts of other women, more squirrels Her mother, I'd hate you to miss sex, when she wanted to be a nun Her mother, I'd like to hear this. What do you know about a man, when she wrote home about her lover whose mother taught her to knit when she wrote home about knitting, she was still girl incognizant, still the girl writing, We are the face we wear where in flashback Still the girl with a face like a movie screen who knit skull caps with yarn red as cartoon blood, as red as Mammy Two Shoe shoes, matchstick heads. Yarn red as cartoon lips, tongues, red as bandanas and pomegranates {lipsmack} Red as blood that says woman, maybe mother, says watch and count Red as blood butterflied across the seat and white as summer ((coulades.)) Red as red velvet cakes she thawed and ate over two months' ((mourning)) time Red as red velvet curtains she wanted to drape around this moment Red as warning, as bluster, as bluff, as the flat of offering plates Red as warning, as unheeded signal to stop, as sliced rare meat Color that= the= tem- that the temporarily colorblind first perceive Red ~B utterly fly swims through corner voices. To ((~B)) is to ((~B)) Color that disappears in early film Black, boot black, blue black ~B utterly fly, ~B itch, ~B road, ~B ache, between want, have, reach She wants a sleep that shutters her like the small corner bodegas She wants a sleep against this neighborhood graffiti of noise But need is the swarming of a sonorous and deep darkening hive But need is the swarm that only a keeper can take tact against What'd she know about silence how it settles in the throat like swallow What'd she know about ((be coming)) to mind at times she thinks she don't think How her throat tightens like a branch on which cataclysmic swallows roost How her throat tightens, tracks through slow syllables, memories, weather um Geometry of a Park Pool A boy presses her twelve year old head, geometry of an air filled melon beneath+ water with deft hands she struggles against. Someone she can't remember sees her thin arms as she struggles against those hands. That struggle breaking the water's skin as if to make plain the difference between a thought and a need as if to map the shifting climates between words and bare knuckles as if to show her knowing wasn't needing he says he was playing as if to show her the winters between words and his budding fist, he laughs His young voice filled already like a snow globe with the coming winters His young voice filled all her thoughts of water echoes in each syllable Yesterday swarms in the marrow of yore, our thoughts as she lies there here sleepless. Yesterday swarms in to eat or not to then what she clears her throat {lipsmack} You can't be eating from everybody, her aunt warned after the first loss You can't be eating like you don't mind trading a baby for red beans That yarn's redness bleeds Persephone, Eve, Jemima, ((Reenie,)) more squirrels, that yarn's redness eating from a strange pot, tree, hand, mind, draws blood or sleep Post Troubles Jemima was a daughter of Job's winter Post Troubles, Nancy Green plays pleasant auntie before a car kills her How'd Job's Jemima become a handkerchief headed pancake m- mix pimp How'd Job's Jemima become auntie? Jemima's your momma, she thinks, laughs ((It's)) too late, to think about being No good sleep and such thoughts It was too late to had become a kind of comfort Let such stillness keep The dark husk	Subject	
Fuchs-Greg_Complete-Recording_Segue-DH_NYC_4-22-00	0.269	378.708	The low rumble of an oncoming train, traffic overhead Three people sniffling Who is the male half of People's Couple of the Year? twins'= a- twins' arms are folded, eat hamburger, sneeze, first avenue, rust colored walls don't hold the closing doors ladies and gentlemen One dollar per wind up kids' toy, one dollar, one dollar. Old sweatshirt, cashmere sweater, yellow smoke stain in the white beard, ~UFO yo yo, Fresh Prince, air conditioned car nightmare please close the windows, closed eyes sleeping beauty, beauty battles grotesque. The only goal is to change the world, not obtaining beauty, truth but materially changing the raw data for new information. This is the information that an entire car of people are alive, going somewhere Third Avenue, defenders of the free world, smile, smile, smile Free internet access, the means to literacy are what we must obtain, maintain. Want to be in the know? Union Square Street, precocious child, complaining mom. Saks Fifth Avenue, shaking onto one another. Come on, people. Shine on you brother. I want something to drink or eat. It's not for drugs, it's for snacks. The crowds don't stop coming. The weekenders don't even know if they're going East or West. Leopard skin jacket casts a flirtatious smile. Families' groceries on the subway bagged in plastic, stacked on the floor, snakeskin shoes. ~F train, Fourteenth Street Black gum spots speckle cracked concrete. Lord have mercy on me, sings the folk rock singer as the world burns. There's no seats on a Saturday. I just want to go home, drink juice. The cool breeze pushe-+ pushes through the tunnel, next train readying. West Fourth. Happy Birthday, says a balloon. Broadway Lafayette. Two women talk, earning money The bottom line is everything, is always between the line But what about when your whole world falls apart, someone asked nonchalantly, How are you? Do you answer, My world is crumbling. I'm lonely. The future of death sleeps next to me The bottom line is not everything. It's just some thing A high end journal is not an insult, even if you intended it as one. Mother slaps her hand, cries more. Blue streaks in black hair. Very rock and roll. She can justify anything under the sun. She's not a bad person. Que pasa? Baby crying, the North face, the South caboose, Delancey. We've all got our own goals and our own baggage The enchanting dark flower, black orchid, heart broken by love without feelings, by letters without meaning, by lies and deceit, by desire. The American flag bandanna exits at Essex. East Broadway, my bad. Phat farm. Hoyt Schemerhorn. Your stuck zipper nerves me. All magazines are ~T and ~A rags edited by ad agencies Spike Lee lookalike swoosh hat, Doctor ~J glasses, totally hot hoochie mommas riding boots say, For all your ~S and ~M fetishes. Party girls out for a night on the town stand across from a couple holding plastic bags, holding each other, baby asleep in mother's arms ~MTA attendant stares down the bongos. Duct taped guitar, tambourine taped to foot, bass drum taped to hand truck, amplifier taped to hand truck, one man band. He's the shit, slow, heavy, repetitive groove. Train beep, track clack, bongo beat, train rolls in opposite track Three earrings and your lover's hand on your head, lemon meringue pie in a paper bag, loony smile on the woman dressed like a man, or man dressed like a woman Author of key witness, eyes closed, hands crossed. What the hell is so funny on your Walkman I count one swoosh on this train, Nike hegemony, sweatshop ladies head downtown, Beth Israel Medical Center, cle- Clemente's Animal people, Weston's Vegetables Poetry in motion, one eight hundred divorce, world spy dot com. Our accountant isn't happy. The car smells like fill in the blank. Meika says she loves bad smell. I will not accept your passive aggressive tactic to get me to phone you. You crushed me Thank you for the letter telling me you're writing me a letter that will explain our misshaped emotions. You crushed me We live where you live. All aboard Amherst on Bedford Excuse me, ladies and gentlemen. I am homeless. I'm not asking for much, just asking for some food, careful of the moving platforms. I'm going to see my friend Charles tonight who um whose mind just split open like a year ago after his father died ((and)) hopefully this won't happen to uh ((Ansem.)) I think ((Ansem's)) stronger than Chuck, so but whatever. I'm going to read ((uh)) like three poems about after Charles's mind split open, I would go over to New Jersey like once a week and hang out with him. um This is what I came back with. On the waterfront Obsesso, wearing a New Jersey gutter helmet Stir crazy, all about ~X, ((feckless)) sleep befriending his pals love and hatred careening, mind ripping, a ((prowl)) busting on a rock and a storm All around, death speaks. The fog obscures the glistening boxes teetering Gotham, Babylon, babble wise to the stars  The fog makes us noir in the company of men, shooting the futility of work. Split the blanket motives. No, not smoking. Playing hooky for paintings. Check out the possible lips on the six train. Tune out, turn on, take in the cracked abstract ((scheme,)) wrecking the plane dealing liberty. Gung ho. Can I come over and crash on the couch? You make a bong and eggs, devil in the morning, many in a leaky boat Wack lineage, suit crawls along platform edge of PATH train, drooling nights, anesthesia algorithm	Subject	
Garrison-Deborah-and-Komunyakaa-Yusef_Complete-Reading_Contemporary-American-Poetry_BBC-Radio-3_7-22-99	0.174	425.532	((I'm a window.)) He's lost his right arm inside the stone. ((in)) the black mirror a woman's trying to erase names. No, she's brushing a boy's hair I should say that um it took me fourteen years to write about the Vietnam experience and at the time I was renovating a house in New Orleans and that pretty much ((prompted)) the moment to write about Vietnam. um I had very systematically written around that experience Well, here's a poem about that's a bit more personal. It's about something I've actually had quite a bit of trouble writing about, which is the death of my father who passed away when I was fourteen and as anyone knows who has lost a parent and certainly lost a parent at a bit of a younger age, there is this # i- in a way, of course it's= it's an incredible tragedy, but there's # there are other things that come with it and I guess as I grew older I felt a strange sense of almost specialness for having sort of survived this thing i- in= in my teenage years and I often ha- have reflected on it as I've grown older that one feels the sadness and the guilt, but another side of the coin is the sense of having been singled out and having been made special by having to go through this experience and I tried to capture that. I don't know if I have, but this poem is called She Thinks of Him on Her Birthday. It's still winter and still I don't know you anymore and you don't know me But this morning I stand in the kitchen with the illusion peeling a clementine Each piece snaps like the nickname for a girl, the tinny bite it was to be one once Again, I count your daughters and find myself in the middle, the waist of the hourglass endlessly passed through and passed through but holding nothing dismayed by the grubby February sun I was born under and the cheap pleasure it gives the window Yet I raise the shade for it, and try not to feel it is wrong to want spring to be a season further from you not wrong to wish for a hard rain, a hard wind, like one we sat out in together, or came in from together. Here's a poem about a situation which i- is ((uh)) probably familiar to many working people, and this one is particularly about working women and the way that we drag ourselves through the day at times. uh Sometimes inspired, sometimes exhausted and I think there is a particular sadness of a woman of a certain age when she begins to realize what she's been doing (({laugh})) with her life and perhaps hoping for something more Works late on a TUesday night again Midtown is blasted out and silent drained of the crowd and its doggy day I trample the scraps of deli lunches some ate outdoors as they stared dumbly or hooted at us career girls, the haggard beauties, the vivid can dos, Open raincoats a flap in the March wind, as we crossed to and fro in front of the public library Never thought you'd be one of them, did you little lady little miss Phi Beta Kappa with your closet full of pleated skirts twenty nine til death do us part Don't you see? The good schoolgirl turns thirty, forty singing the song of time management all day long lugging the briefcase home So at ten ~PM you're standing here with your hand in the air cold but too stubborn to reach into your pocket for a glove cursing the freezing rain as though it were your difficulty It's pathetic and nobody's fault but your own Now the tears, down into the collar Cabs, cabs, but none for hire I haven't had dinner. I'm not half of what I'm meant to be among other things the mother of three Too tired tonight to seduce the father The next poem I'm going to read is a poem entitled The Deck and= um and I think the poem sort of embraces that moment when I realize something that taught me a great deal The Deck I have almost nailed my left thumb to the two by four brace that holds the deck together The Saturday morning in June I've sawed two by sixes ~T squared, ((leathered)) everything, the three bubbles seal in green glass and on the sweat on my tongue taste ((is)) like what I am I know I'm alone, using leverage to swing the long boards into place But at times it seems as if there are two of us, working side by side like old lovers, ((guessing)) each others moves This hammer is the only thing I owned of yours and it makes me feel as if I've carpentered for years Even the crooked nails have gone in straight The handsaw glides through grease. The toenail studs hole. The deck has risen up around me and now it's strong enough to support my weight to not sway with this old silly wrong footed dance I'm about to throw my whole body into Plumbed from sky to ground this morning's work can take nearly anything ((With)) so much uproar, punishment, footwork, and euphoria, I'm almost happy this Saturday. I walk back inside and here you are. ((Planed)) and simple as as the sunlight on the tools outside. Daddy, if you'd come back a week ago, ((a)) day before yesterday, I would've been ready to sit down and have a long talk with you. There were things I wanted to say So many questions I wanted to ask, but ((they've)) been answered with as much salt and truth as we can expect from the living (({lipmsmack})) I'd like to read a poem called An Idle Thought, which is the kind of daydream of a woman who's married at twenty one, which I was, and occasionally her= her mind wanders off to other passions she may have known. And I'd like to preface this by saying that the poem was written well before Monica Lewinsky ever appeared on the scene, so I'm now sometimes embarrassed by it because it= it contains a fantasy of seducing the president which has in our country this # that subject has played out in a very silly way. But it also contains a British character who listeners here may know so I don't know if people will agree with me that this person is= is of some sex appeal An Idle Thought I'm never going to sleep with Martin Amis or anyone famous At twenty one I scotched my chance to be one of the seductresses of the century A vamp on the rise through the ranks of literary gods and military men who wouldn't stop at the president She'd take the Pentagon by storm in halter dress and rhinestone extras letting fly the breasts that shatter crystal then dump him too and break his power broker heart Such women are a breed apart	Subject	
