file	beg	end	text	speaker	section
PhillyTalks5_Complete-Recording_03-03-98_UPenn	0.147	436.732	All the ((texts)) in the book somehow took place in a space that he defined as the Middle East and in fact many of them really didn't or don't in= a= in a mental space or even in a physical space and part of what I was up to there was to include the sense of those spaces in wherever I was. um And this is something that I've found to be extremely difficult to do under again American circumstances. I find very few writers who are able to do this and I got permission or instruction, you know permission in the sense of= of Duncan's permission to= to enter a meadow through the work of= of uh # through the wonderful work of Etel Adnan the Lebanese uh writer who as she says u- uh now wr- writes in English and paints in Arabic {NSV} u- um because essentially she grew up without a language {laugh} or with many languages. um These are things that can be seen as advantages or disadvantages depending on how you look at it. Growing up in a colonial atmosphere with displaced parents who had several languages which were not the dominant languages, et cetera et cetera. She ended up writing in English and somehow placed herself in American English but brought in all of this experience and to me that was something that was very instructive um and something that= that allowed me to try to think about ways in which places could be themselves and not at the same time because I think there's a privilege given to place which I have tried to somehow contest at the same time as I invite it and embrace it um So where I am exactly in all of that is= is extremely difficult. I mean I # there have been n- number of years in which I've simply worked in translation because I didn't know where I was in terms of where I would begin my language. That's it. Yeah, ((I don't see #)) that- that's= that's good I mean its a good answer um How about if we read a little bit? and then open it up to discussion would that work. Yeah? Can I ask a question first? You certainly may. um So I just scream it ((at her)) No, just # I'll repeat it. Speak it uh Okay. um I'm actually # this is such a simple question. I'm just wondering what you heard that made you say that's my voice Oh, well I didn't # I don't # uh a- are you asking that of me or of him? I'm asking you, yeah. uh ((Answer)) to the # ((a)) question about the answer that you gave before that uh Oh, okay. ((Yeah.)) Yeah. ((the name too, it's)) y- Yeah. um Right, well v- voice is a word that is so burdened with theoretical quasi theoretical poetic qu- quasi p- poetic overtones that # I= I did use # there was a specific word I used when I described this before, but I think I want to back up and= and try and say that a little differently because uh it c- # the idea of voice can very easily be confused with the idea of a person or poet having a voice which is= a= w- is a way to ((eliminate)) talking about that person's w- work and style and method and ((hm)) the results thereof and so forth, rather # um pretty much or at least in my view or for me ((people that.)) So uh what the wq- # so in a way the question is, What did I hear and was it a sound y- you know, because the first thing it was was a sound it was a sound of a thought, of a way of thinking, okay? So the phrase that I used that you heard me read at the end of um Absence Sensorium, We will crush the arrogant kingdom in our days, that's right from the liturgy uh ((that)) essentially is um and there are actually {laugh} many other in what # in that that= that are a way of my trying to bring forward a ((liturgy.)) Now the liturgy would # I'm going to take two minutes on this. The liturgy is= is actually a r- # a= a= a place where it's a # an anthology. The liturgy is an anth- # the= the liturgy that is the standard liturgy+ of of the tradition I grew up in which essentially is conservative Judaism and # uh w- which means Orthodox Jewish liturgy, translation okay uh is a residue of the rabbis around the uh turn of the Common Era, round # of the first few centuries. That's what it # what # and= and then again, another layer from the= uh the saf- the Safed Kabbalah, especially around the s- the Sabbath. All the liturgy around the Sabbath is from # a lot of it is from the sixteenth century from the town of Safed where a lot of Iberian Jews wound up and there was a really sort of very intense m- uh mystical and Messianic body of thought that finds itself # its way into that. So what I was hearing, I didn't know that, actually at that # I mean the point at which I heard these sounds, I did not know what this stuff was. I didn't understand I was hearing history, or people, individuals, or an anthology. So for me what I heard w- was a sound that sounded like the way I would think And then when I went and started to ((g-)) # look into it, and ((uh)) by no means am I a scholar and I don't like to pass myself off as one. I'm not, you know um ((uh)) thankfully, which means # that means I ((could)) stop reading it when I {laugh} feel like it. ((I know that)) # yeah. uh {NSV} If you know what I mean, I don't # have not # I don't have the responsibility to be a scholar. So um but that's what it meant. What it meant for me was to act- # what it turned out to mean for me was to actually hear a group a bunch a= a succession of people wh- whose individual intellectual work in ((well)) poetry because all intellectual work in that group of people, in that historical group was poured into this. ((I mean in)) other words, they= weren't= they weren't doing {laugh} science. They weren't # you know they weren't actually writing uh quote unquote secular literary works so that this work that they did that uh w- was colle- # is collected in midra- # in the Midrashim, in the Talmud and so forth, is all of their # all impulses of thought poured into a single vessel, which makes it extremely rich, at least for me. So uh Just to # yeah, to= a- to add to that um, there's a phrase some of you may be familiar with. The uh= uh # Nathaniel Mackey's phrase of uh, Music is wounded kinship's last resort uh which is something that I've come back to again and again, and it's I think an amplification of an idea that	Subject	
Piombino-Nick_Complete-Recording_Ear-Inn_NY_4-22-89	0.422	408.229	Science is keeping work is weeping To be decorous is not to be formalistic. The first may simply be showing sensitivity to a formal context. The second creates a context. In every day practice, truths are detected by apprehending cadences. These are confirmed by a kind of subliminal sounding that employs aspects of vision and touch Charm furthers propagation They ((could)) interrupt or stop anything but true celebration Celebration, cerebration Could this have been the first act of mental freedom Pierce the membrane between philosophy and poetry and something starts to leak, then flow Happiness is always conventional Irritation, surplus stimulation Wisdom. Does it consist of little more than accepting how long it takes for something to actually happen? If satisfaction is the measure, this is easy to see Perfection is a kind of surface. Wholeness must be bounded by a shell or skin To be a unit is to have an outside and an inside Place your bets, then laugh, and the game comes to an end, so soon {NSV} In case you might forget, exaggerate Adhering to the world by means of glue, ideas are useful mainly when they're wet But the dry remains fascinate Reality is like a sea The world contains many thoughts and few images. Okay, I'm going to read a few more journal selections and then um ((Bruce Sanjo's)) turn. Seven Eleven Eighty Eight In order to live at the pitch of contemporary life, we acquire the ability to forgo the intervals of time that are actually needed to consolidate and make part of ourselves what we have already experienced Because of the multiplicity of life's possibilities and demands, there is little time for this Thus we gradually harden ourselves to accommodate reality and even further forget what it is like to imagine really digesting something Seven thirteen. Time out of time The more I am heard, the more I must resort to silence to be heard The faster I go, the more stealthily I must move Seven fourteen The imagination forthrightly encountered can never betray and will always reveal For this kind of encounter to be open internally, however, is as difficult and consequently as rare as in external encounters Seven eighteen. Life presents itself to us all at once at all times in its entirety Seven twenty one. Is it possible to surface unconscious aspects of the identity making mechanism and thereby experience the nexus of the percept coloring process? I think this is done and can be done again and again in new ways by reading and writing poetry. What makes us what we are is determined by what makes us see what we want to see On a social level, the gradual assertion of the rights of individuals is determined in part by the value ((that)) the society places on the individual This value not only determines what a society can do to protect the individual, but what contributions individuals can make to society If all individuals are equal, are all individuals then equally expendable? On the other hand, can an individual shed society and thereby transform it? The determination of the value of protecting the individual is also fostered by the concept of genius. It may be that genius is fostered by a mutation of a society's ills with its strengths Genius has a way of affecting society deeply, although it is asl- # always the product of an individual Another aspect of genius is that it is an idea that returns to all individuals of value by demonstrating that individuals can make a difference in helping reshape society. Just as importantly, the age of machines has intimidated human beings to the extent that they demonstrate the immense potential power of not individualizing. Equivalence of mass ((produced)) parts Society is tempted to imitate the powerful machine by making its members conform to their ways to producing so uniformly. Of course, the individual soon realizes the value in learning what are the aspects of non res- # reproducibility, which are ((a)) value Seven twenty six. Anxious, embattled. Same thing Seven twenty eight. I've lived with time so long as a limiting and controlling reality that I'm ((ruined with)) thinking of it like this. I need new images for time. I am tired of being pushed in front of it, like a child being urged to take its first step or like a pet being dragged along its staccato steps, lurching forward one moment and then seeming to drag on forever. Locked in a room, waiting for its chance to get out I can learn to accept a concept of time that is inexorable, leading to one inescapable outcome. But I can never accept a mechanical view of time that allows for no individual experience. Eight seventeen. Every place has its elsewhere, its neighbor not yet completely known, its strange part We think of the known as the conquistad-+ conquistador+ of the unknown. Two fast terrai- # two  vast terrains, each pitched in darkness, one advancing on the other, and the other in grave retreat Probably a more apropos portrayal, such as may exist between two people, let's say, allows for a more dynamic yet webbed relationship than that And partly because the two quote sides are exchanging something vital to both, like a hot potato that neither completely wants, yet neither can completely get rid of either, over time the relationship transforms both At the boundary point between the two, there are leaks, clusters of origination that might erupt briefly but frequently at this peripheral+ zone, then melt away	Subject	
PoemTalk-198_On-three-Larry-Price-poems	0.86	361.756	And that the whole personification that happens within your work and especially um theirs it's um uh to ((show)) that whose monologue is it, so to speak. (()) Inner monologue when I # any one idea stands on stage for seven seconds so the idea has somehow become the presenter of the monologue. That's e- e- # that's right. I mean, the question really becomes why= why are we writing. Who is it that's writing. Why did that start writing. What started writing. What is writing to what? And so on. I mean, there are all those questions that you know, it # an ((I,)) is it an ((I?)) And I'm not so sure that I want to invest everything that I'm doing in any particular place, one place, because I think, you know, time and space are always going to be complicated and I don't think the writing comes out of any one place. I think it comes out of this as I said this melange of= of debris, forces, factors, operators. It's, you know, it's= it's complex and so ((you have)) I'm really interested in But (()) but curiously here you you then # but you and I are here now. Mhm. Well, I ((love that)) trying to ((bind.)) Right. I mean, but it's an address, you know. (()) (()) To the supposition I= I love I'll be. Andy Warhol. I'll be. In other words we're going to try so- # try some identity on for size. Mhm. I will be and you will be. ((Everyone)) (()) You= be= you= be= you be. Oh, I thought you were talking about like Walgreens or something. ((It's)) (()) over in aisle ~B. (()) {laugh} Oh, sorry. That's alright. You can ((add a big)) This is what we get with ((Bill)) (()) That's right. um So but it's not I'll be George Patton, I'll be some solid character. {laugh} Mhm. It's Andy Warhol. Course, Andy was actually a mirror. You know, whatever ((you know)) and Andy was not interested in identity, selfhood, and so if you and I are here now, seems like a solid uh soci- sociality, you know, an agreement, that we can be meaning # we can make meaning together, we can co-create this thing that's happening here, maybe, in this poem um and then in doing so I'll be Andy Warhol and you be everyone else, what we've established is a persona that is an anti-persona {laugh} and set against that is a kind of an entire audience, maybe everyone who reads this poem or who's sitting in= in the crowd gets to be everyone else but it's not distinct from the I because I will be nothing and you will be nothing. Anti-Ted talk. Anti-Ted talk, say a little more about anti-Ted talk, because= because I think Ted talk # I don't think that Larry was thinking of Ted talk but that is everything that's wrong with {laugh} speaking to an audience. Yeah, I think it's dislodging monologue from like its authoritarianism and it's making the= the poem's existence is an invitation for a connection between audience and speaker (()) So it's not # it's= it's inviting the collaboration of both parts that create the occasion for meeting anyway. It's not I talk, you listen, I know you don't. Yes. It's Right. it ((says)) which comes in parts of certainty the monologue doesn't have. It's certain because of the relationship, not because of what the monologue is saying. Mhm. That's right. Before (()) ((we were talking)) about the I and I was disowning the I but at a certain point you actually have to own up to it. You have to say, Alright, I'll take this on for this moment, just for the a- absolute fact+ fact of connection. And that's not ironic in the least. That's actually quite (()) Well, (()) (()) ethical (()) absolutely it's ethical, but is= is irony unethical, I don't think so. No, it isn't. Hm. (()) But th- the problem with Ted talk ism is that they s- # the implication is we need more than fifteen minutes of fame um you know, we= need= we need to have a serious conservation, you know, and I've been through this and you're an audience who's listening to me and it's usually very personal and very philosophical but it's fact fifteen fucking minutes of fame. A Ted talk. You're trying to get through s- # you want to get to a place where it's more than that, I think. Absolutely. And ((at)) # ((I mean)) there's I mean (()) yes {laugh} I can't say anything more than that, I mean I really agree with what you're saying. I think that you know, a- again I # we've got lots of straw people around and th- they walk around looking and sounding very important, only because we elected them. and, you know, we can just dis-elect them. {laugh} I think and= and when we do that we get to like take up altogether different roles in some kind of cooperative. In this case (()) you know, it's all stages of drama ((but)) obviously you know, it's everywhere that we are ((so)) Bill thought, another thought on this piece before turn to the third one. Well (()) I love this typical inversion that we get here between a crowd and a empty stage, or a stage and an empty crowd. um That's kind of unfortunate, isn't it. {laugh} I mean, I didn't want to imply that the crowd was empty, altogether empty, but I think that there's a possibility that's a lot of times it is because the crowd comes with expectations that invest the performance with more solidity and importance than it actually deserves and to me that # all that does is empty the crowd's expectations onto the stage where those expectations ((then)) act out. I don't want that. I want complete contingency. I want the accident, the unpredictable, I want to y- you know feel that there might be all kinds of encounters that happen, you know, at any given time. We just need to be open to ((that.)) (()) I think that's em- embedded in though in that r-	Speaker1	
Raworth-Tom_Complete-Reading_MFA-Reading-Series_Boise_2-22-13	0.071	467.383	Shaking it, I look at your watch, which is white Roman numerals on a black face, ((I past I)) The magazine trembles at your elbow and a bright yellow card falls to the floor. Picking it up with my left hand I read, what you have in your right hand is an umbrella. Float. ((Well)) (()) ((explain how)) time acts in a poetry reading. Strange time ((freaks)) attend them, wallowing in seconds becoming hours, hours becoming limping treks across a desert ((life)) without water. ((The)) poetry (()) becoming almost totally uninteresting and the only fragment of interest left is that which the color and smell of gangrene has for a connoisseur Over noise. Every second brought beauty, before vegetables, before ancestors, thought grew thinner, everywhere except in pressed tales, thought that changed, regulated loose connections, losing slices of purity, Characters crowded forests of ((moss)) ((stamped skill)) with certainty, a bird joined dry bones of puppet regimes ((off road,)) people remain afraid within prisons of perception, without water. All dissipates into noise. Thor Heyerdahl solved the mystery of the statues, that wasn't the mystery. True ((sights)) of the enemy is not you.  Noble journeys into the unmapped, I mean the boredom of a (()) against Leif Erikson, courage and knowledge are not enough. Pleasant ((batter)) again. Why I am not a mathematician. The dictionary of real numbers was designed for researchers who have encountered various numbers computationally and want to know if these numbers have simple form. The book is structured as a reverse handbook of special function values. It lists over a hundred thousand eight digit real numbers ((in the usual)) one comma zero that arise as the first eight digit (()) special values ((of)) familiar functions. This book should be of interest to researchers in mathematics. Drone of your own. Leveraging crowdsourced data and mining social networks, mice engineered to lack specific genes, infected neurons with a virus that inserts a gene which renders them responsive to blue light. ((Crowd hunters)) of images. Remains are handled in a culturally sensitive and religiously appropriate manner. Presence without value is perceived as occupation. Today we have commonality of parts. ((Void)) between lethality and inaction, marketing ability in current trend perception. Coffee, tobacco, hemp. Plants measure length of night but not cucumber. Winter ((stoat)) in moonlight as we slumber. Where does light speed? Something must be where light arrives, dark ((over a)) head, things darkness made. Freud is tall, ((Marla)) is small. ((Is)) a very short poem. Sound pound. Four thirty three. Bird, no singing cage. ((Sharpening)) aggravation of perception. Whole, giant discovery falls heavily, outside language move dances. Evenly those moments set, travel away, (()) in area float, farmhands of posting. Functions not mirror operated, memories smashed to understood. Now we have a poet laureate who's completely unreadable and abysmally banal. So she wrote one piece and I could only read it by making an anagram every line. (()) right from banana jar by fanny fur coda. Pageantry fever there it has met quote, teacakes, mirthless moon enshrouded to a toy (()) irony overdubbed one high ((trot)) barber's ((verb)) (()) web. How are (()) simonize his ((whole retina)) her token untamed over, ache. Head renting hemp and (()) pull my uptown husk before hot deer. I wholesaled elk (()) reheating tents ((last)) (()) ((where)) he deadpanned a (()) wig thus, yow. Out of an outhouse sorority slut your heartbreaking (()) bald-faced ((honkers)) (()) noisy you (()) ((were)) druid babes called tin horn. Close the loop on this. Not enough boots on the ground to square the service, a paradigm shift we need to get our heads around, we need to analyze a perfect storm, put lipstick on this pig at the end of the day, put a stake in the ground of our core competency, hope is not ((a)) strategy to move the needle, this time it's different because the next big thing is the elephant in the room comparing apples to apples. This is just a found poem. New ~EU plan to stop banks failing. ~BBC news. Queen humbled by jubilee events. Venus makes rare trek across sun. Exercise, no help for depression. More body parts found in Canada. Local news, Sussex. Air ambulance crew received medals. ((Jubilee)) beacons are set alight. Leisure center upgrade completed. Olympic games. Employ magics, images comply. Myopic ((gleams, gaming)) polemics. Simply ((cage)) (()) ((lips)) mom. So gimpy camel, so pick me camel. Place my gizmo (()) limos came. Magic mole spine, my magic slope, sly magic poems, slim cagey poem, over my scampi, go clammy pies, play memo pigs ((camp)) slimy ego. Scam my epilogue, comply ageism, email (()) impale my cogs. ((Commie)) spy gal lags mopey mice. (()) smog ((cocks)) me ((gaily.)) A (()) The book of titles. I don't want to be a writer. The last priest. Send the rich to the gulags. Grandmother's dangerous garden. Bomb Paris. ((While)) the ((parrot is)) Big, black, and scared. Floating and talking. Too old to be a poet. Thought everything on the ground is a chestnut. ((Wait,)) the cheese. So the Department of Homeland Security had to release that list called the ((analyst's)) desktop binder. ((Of)) the key word of phrase it uses (()) troll through the social networks of terrorists. So I thought I'd just (()) use all those words in something obvious.	Speaker1	
