file	beg	end	text	speaker	section
Andrews-Bruce-and-Charles-North_Complete-Recording_Ear-Inn-NY_10-28-78	0.144	584.826	((Through the)) ((terror)) of the monumental ((snores)), scattered like leaves, marked and ((taken)) by your ((entrance.)) Gas station {cough} ((for)) gas station Technological, annoying, miniature asshole ((of the stars.)) This is no longer the (()) ((trouble)) but a ((coin in the right place)) can do wonders. To be reckoned with ((on)) all ((trips,)) large as well as small. ((Beyond night)) and its ((Labrador retriever)) the dim tree (()) up into the ((star post)) outlined in blossoms compressed to silhouettes ((almond, olive)) (()) morning glory. Chaucer. A love poem. {laugh} {laugh} It occurred to me that I should have (()) that eight years ago when I ((wrote)) the poem. The title is just Chaucer. ((Into that)) society, Geoffrey Chaucer was born, and he died without seeing it returned to the way he knew it partly through his agency. So I can imagine the sight of the peasants ((drawn up)) outside the walls of his city drove fear into the hearts of King Richard and his nobles, of which Chaucer was one, and barely escaped with his life. after the reprisals that ((followed)) hard upon the unwillingness of privilege to dispense with ((its)) ornaments. Fortunately, Sir John (()) then a judge in the courts, was a good friend of Chaucer's, when a poet might not have lived to produce the works he did. And it was, of the hundred twenty projected tales, Chaucer managed to complete only a handful and it is on these that his reputation rests. And ((when)) the plague like a guided missile, struck down half of London it did so by bypassing the city's chief customs inspector. ((As)) Chaucer escaped both the plague and the rebellion of the peasants, so I escaped not knowing you, et cetera, et cetera. {cough} Leap year. In ((a)) language of the spirit one of the waist high metal ashtrays is on fire. Ah, in the ((lounge)) of the spirit. I ((was)) on the verge of waking up ((in it)) as that (()) is clearly melting into the sky. The sky ((and the)) (()) as if (()) ((were)) (()) and the way out were to paint everything turquoise. The night ((crowded)) by stars, people ((drinking)) everything in sight, a ((bus)) taking (()) from one city river to another ((charred in glow)) of not knowing the ending. {cough} The ((Brooklynese)) capital. Some (()) for (()) The Asia of New England. The ((parasol bath.)) The (()) brandisher. ((Xeno's)) gold (()) cookies. There will be (()) There will be (()) ((Masonic)) (()) The deflector of the night's (()) ((devouring)) omelets. The ((beret)) of age. Some ((joke)) The ((whale)) cartel. The ((green)) fingered dawn. The critic of peace. ((When does)) (()) The (()) of Tuscany. Mortality's reiterator. (()) river whitefish. The ((foot wigwam.)) These ((distractions, they are)) (()) The second baseman of composers. I think that's Chopin. {laugh} I (()) can check. Never been able to check before. I should check. Yes. Wait (()) The light slurper. The weekend divider. The ((face's mood ring.)) Ambition's green monster. The smegma convention. Card carrier of the (()) (()) ((your)) (()) The ((mouse that plucked the sea stallion's aimlessness.)) The Anglophile of languages. (()) tourniquet. The gravy supper. The (()) ((Tennis)) victims. ((Sewer)) (()) ((ballet)) The Netherlands of lips. The mouth flounder. The parasitic trade. ((Pam)) and ((Jerry's)) The pill pushing race. The ((fisher for midnight oil's Cupid.)) The cigarette pyromaniac. The mosquito beach. Sunset's hamburger extender. The ((Brooklynese)) capital. The Gatling gun of despair. The tongue motel. (()) Sexual= sexual liquid lunch. The game delayer. The ((rose coup.)) The escape from sleep. (()) The ((shrub settee.)) The rum runner's Louisville slugger. The ((penis code.)) (()) ((stuffing.)) The deflator of leisure. The barber's friend. The fried egg dish. The winter (()) The (()) The (()) ((city.)) The George Washington Carver of boredom. The schnitzel of the Alps. The ((smell way.)) Lines. As (()) an evening taken together by the same thing. The morning air ((dents a jar of tulips)) and (()) affairs are wasted with a dispatch of elegant theory. The empowerment of leaders begins its arduous journey through permanent display, pink. A parade of points, green, turning out products. (()) highway to ((art,)) to (()) ((for)) the free movement through elevated channels causes the scale to fold, the council to abandon. (()) {cough} (()) ((If I)) (()) ((sleeping)) and (()) and the baby are sleeping and the earth is a ((wheel)) on a blanket of emeralds held out at arm's length to ((locate)) the smell of gardenia and ((ingenious)) honeysuckle ((here by)) the precise moment the north light turns illuminating the wildly creaking carriage against the east (()) showing ((a)) layer of boxes of unopened presents (()) et cetera. The paint beginning to peel. ((Cold)) wind rushing past ((colored)) insulation and ((stopped but)) there over her head. (()) then I think the fathers of the world are out of their minds, getting up in unison, leaving warm beds and (()) our cold feet past the ((cold)) bathroom.	Speaker1	
Antin-David_Complete_Seminar_University-Buffalo_3-27-03	0.14	462.427	You know gallons and gallons of gasoline in huge tankers that are explosi- # that are flying explosives. I mean, I don't know. I mean I= I= I # you know but they don't talk about that, that # you know that # uh you know they say the= the food nearly didn't reach the f- # uh the= the troops, let alone the humanitarian aid. The food nearly didn't reach them for the next two days. So what you have is all these supplies have to go into # you know high= high tech wars require high t- # uh re- require freight But you could've # I mean I could've run a news program. In the area of twenty minutes, I could've produced an absolutely clear articulate example of what we knew and what we didn't know very clearly. ((And)) I said, Now go to sleep people and wait for something to happen. {laugh} You know, it would've been the end of the program and not enough s- # ((I mean)) it wouldn't be enough advertisement really, I mean but ((uh= uh)) when I left it on more than fifteen minutes, I had to turn it off because I heard ((this#)) they were recycling the same bullshit Now that's not a glut of information It's a glut of pseudo information mixed with information= information, but information is a novelty. i- i It introduces a novelty into the structure, the unexpected uh And the unexpected of course was the geurrilla war which opened up o- on our flank. Although in classical warfare texts they always say, Worry about that if you're going to s- # have a long # single long line These guys didn't worry about it In fact they were afraid to say that it might've been a misjudgment. I notice when= the= when the newscasters talk they say, Well, some people might say that it was a misjudgment of the military, but we're not sure The # I mean that's literally what they said I mean there's no textbook in= mili- in= in military operations that doesn't refer to the dangers of= exposing+ er ex- of exposing a long flank (({laugh})) I mean it's ancient military lore. The Chinese knew it # the Ancient Chinese knew it, the Indians who played shatranj knew it Don't let yourself get exposed on a flank. You can be cut off. So I don't know, I mean I # in that sense I= I think that it takes a good deal of precision and careful thinking to be able to get somewhere. And what I do is think Have mind, will travel {laugh} I'll think as well as I can and I take pleasure in thinking I take pleasure in trying to figure out what's happening in # to= ((to)) myself, to the world and I think that's part of the pleasure of poetry ((It's)) the pleasure of the abil- # of pleasure of thinking and= and not locking yourself in. Now, it's not the pleasure of reading an Anthony Hecht poem about which I have no= no= no (({NSV})) I don't have any terrifying feelings that ((they're)) terrible but if you want to write Robert Browning uh dramatic monologues and= and update them slightly, that's what you're going to get. It's okay Has dramatic # it has certain dramatic, cynical character that you could say there's a little frisson that it produces at the end usually or at somewhere in the middle of it. Great, alright It's okay. I mean it doesn't bother me. I= I= I have # I= I= I don't # but I don't # not interested in that. I mean, that's= not= that's not an artwork from my point of view. Or if it is, it's a sort of subsidiary artwork. The school of Iowa produces something like a Diet Coke {laugh} (({laugh})) Well, it's a very modestly pleasant drink, you know? Well, it makes you # that makes your teeth ((great)) because of all the goddamn saccharine {laugh} {laugh} I think we should take a brief break now. Coke break. {laugh} Buy a Coke break. Some type of drink ((that's #)) ((Break time.)) ((So)) we'll come back in let- let's say ten minutes. Five minutes after two. Coke break, go. Okay. We'll resume for about an hour. ((Am)) I answering the questions, or am I too= ((uh)) too digressive? {laugh} I think it's fine. {laugh} Nobody disagree. {laugh} uh ((As)) Okay, it's recording now so I'll stop ((lying)) Everybody is not quite back but ((think so.))  No, no. Well, people will come back eventually. ((It's your story.)) What was the line in the nursery rhyme? Leave them alone, and they will come home, wagging their tails behind them? {laugh} ((Would you like some chewies?)) {laugh} Would you like a chewy? No thanks. {laugh} ((I can't complain)) But it has a good look of minimal art. {laugh} I know, it's nice. ((It could be there.)) Alright. Would you like me to go? Go ahead, I'm going to stop now. ((We're all just trying to)) micromanage ((the same pieces it #)) Okay. Okay. um I was thinking about something you said a little earlier, that information is novelty And um I was thinking of # and something I was  talking about was how the # how you're talking s- # um the thing I think of is fugues. How you bring up a theme and you develop the theme and then later um the themes, maybe they change a little bit or maybe you move them. And I was thinking if you could talk like um {lipsmack} one, kind of how= how you how you manage that as you work. I mean, what's what goes on through your head as you do that Is # uh do you think of it in terms of= of like managing themes I don't now. uh When I was writing in a uh um more procedural poetry uh i- I actually # in= in the book called Definitions the poems called Definitions ((Fermenting)) was constructed to be a fugue uh and it was constructed specifically uh on the structu- # it was built entirely on the structure of a fugue. There's= a= there's a wh- # set of themes that come up uh, one of this was this whole thing called # uh where I took a definition from an insurance book. I= I= I ((saw it)) # as I said, my lack of understanding was always one of the things that got to me.  {laugh} And uh I had been trying to r- # deal # address a loss of= a= of a dear friend who died very young and this is many years later because I tried it once before and I hadn't been able to do it. And uh I was living in= in uh in a corner of the Bronx near the Whitestone Bridge since ((you)) had a good library. It mostly was filled with Catholic uh Catholic philosophical texts, which was ((rather)) nice because they had the journals of Simon Weil So uh # but anyway, I found a # an insurance manual, I figured they would know what value is uh and what loss was. At least they would know what loss was. They might not know what value was. So it # I found a phra- # I= I went to ((him)) and I found in the insurance book this, Loss is an unintentional decline in or disappearance of a value arising from a contingency {laugh} And ((I'm thinking)) that's fine but I don't know what a value is, so I went to the dictionary and I found out what a value was and ((it)) says # ((and that=)) that comes from the= the particular dictionary I was looking at So uh then I ((had)) specifically started mediating o- # meditating on you know in a way that you would by playing the themes in relation to each other. ((uh)) You know, uh the term fugue is a metaphor but there was something like my instr- # interest in what # you know what they called the stretto that is the bringing toget- # ((the)) tightening of the distances between # uh narrowing the distances between um the= mater- the= the= the materials ((uh)) through one theme and another, you narrow the harmonic distance to play them closer and closer c- # uh closer	Subject	
Ashbery-John_01_Complete-Reading_WBAI-FM_New-York_5-14-75	0.39	432.193	Because the old man had peed in his pants again was there turning away from the later afternoon glare as though it too could be wished away Was any of this present and how could this be the magic solution of what you are in now whatever has held you motionless like this so long through the dark season until now the women come out in navy blue and the worms come out of the compost to die it is the end of any season You reading there so accurately, sitting not wanting to be disturbed as you came from that holy land what other signs of Earth's dependency were upon you What fixed sign at the crossroads, what lethargy in the avenues where all is said in a whisper What tone of voice among the hedges what tone under the apple trees Numbered land stretches away and your house is built in tomorrow but surely not before the examination of what is right and will be fall Not before the census and the writing down of names Remember you are free to wander away as from other times, other scenes that were taking place the history of someone who came too late The time is ripe now and the adage is hatching as the seasons change and tremble It is finally as though that thing of monstrous interest were happening in the sky but the sun is setting and prevents you from seeing it Out of night the token emerges its leaves like birds alighting all at once under a tree take up and shaken again put down in weak rage knowing as the brain does it can never come about Not here, not yesterday in the past. Only in the gap of today filling itself as emptiness is distributed in the idea of what time it is when that time has already passed Scheherazade unsupported by reason's enigma water collects in squared stone catch basins The land is dry Under it moves the water Fish live in the wells The leaves a concerned green are scrawled on the light Bad bindweed and rank ragweed somehow forget to flourish here An inexhaustible wardrobe has been placed at the disposal of each new occurrence It can be itself now days almost reluctant to decline and slowing down opens out new avenues that don't infringe on space but are living here with us Other dreams came and left while a bank of colored verbs and adjectives was shrinking from the light to nurse in shade their want of a method But most of all she loved the particles that transform objects of the same category into ((particular ones)) each distinct within and apart from its own class In all this springing up was no hint of a tide only a pleasant wavering of the air in which all things seem present whether just past or soon to come It was all invitation so much the flowers outlined along the night alleys when few were visible yet their story sounded louder than the hum of bug and stick noises that brought up the rear trundling it along into a new fact of day These were meant to be read as any salutation before getting down to business but they stuck to their guns and so much was their obstinacy in keeping with the rest like long flashes of white birds that refused to die when day does that none knew the warp which presented this major movement as a firm digression a plain that slowly becomes a mountain So each found himself caught in a net as a fashion and all efforts to wriggle free involved him further inexorably since all existed there to be told, shot through from border to border Here were stones that read as patches of sunlight There was the story of the grandparents, of the vigorous, young champion the lines once given to another now restored to the new speaker dinners and assemblies, the light in the old home, the secret ways the rooms fed into each other but all was wariness of time watching itself for nothing in the complex story grew outside the greatness in the moment of telling stayed unresolved until its wealth of incident pain mixed with pleasure faded in the precise moment of bursting into bloom its growth a static lament Some stories survive the dynasty of the builders but their echo was itself locked in, became anticipation that was only memory after all for the possibilities are limited It is seen at the end that the kind and good are rewarded that the unjust one is doomed to burn forever around his error, sadder and wiser anyway Between these extremes the others muddle through, like us uncertain but wearing artlessly their function of minor characters who must be kept in mind It is we who make this jungle and call it space naming each route, each serpent for the sound of the name as it clinks dully against our pleasure. ((Indifference)) that is pleasure And what would they be without an audience to restrict the innumerable passes and swipes restored to good humor as it issues into the impervious evening air So in some way, although the arithmetic is incorrect the balance is restored because it balances knowing it prevails and the man who made the same mistake twice is exonerated. The tomb of Stuart Merrill {NSV} Stuart Merrill was incidentally a nineteenth century American poet who uh immigrated to France and became a # one of the= uh the s- s- # French Symbolist poets (({breath})) It is the first soir of March they have taken the plants away Martha Hoople wanted a big gnossienne hydrangea smelling all over of Jicky for her card party. The basement couldn't hold up all that wildness The petit fours have left. Then up and spake the major, The New Conservatism is sitting down beside you once when the bus slid out past Place Pereire I caught the lens cover reflection. Lilacs won't make much difference, it said Otherwise in Paris, why you never approved much of my pet remedies I spoke once of a palliative for piles. You wouldn't try or admit to trying any other Now we live without, or rather we get along without each other each of us does live within that conundrum we don't call living, both shut up and open. Can knowledge ever be harmful? How about a mandate? I think of throwing myself on the mercy of the court.	Subject	
Ashbery-John_Complete-Reading_Contemporary-American-Poetry_BBC-Radio-3_7-24-99	0.384	446.378	Only immaculate darkness and thunder. She grabbed Sweet pea. I'm taking the brat to the country. But you can't do that, he hasn't even finished his spinach, urged the Sea Hag, looking fearfully around at the apartment. But Olive was already out of earshot. Now the apartment succumbed to a strange new hush. Actually, it's quite pleasant here, thought the Sea Hag. If this is all we need fear from spinach, then I don't mind so much. Perhaps we could invite Alice the Goon over, She scratched, one dug pensively, But Wimpy is such a country bumpkin, always burping like that. Minute at first the thunder soon filled the apartment. It was domestic thunder, the color of spinach. Popeye chuckled and scratched his balls, It sure was pleasant to spend a day in the country. This next poem must date from about nineteen seventy four when I at last just {NSV} could no longer escape teaching and= and began teaching uh poetry to students at Brooklyn College and found myself immediately assailed by their questions about what is poetry and why is this a poem and why do you say this isn't and uh what is poetry anyway and # so this called What is Poetry but the title has no question mark {NSV} And uh I don't think it was probably very helpful to the students but it was part of my finally beginning to think about what is poetry myself, having done it for a long time without ever having asked myself that question. And it ends as so many of my poems do or= or rather {NSV} they include lines of b- bits of conversation overheard very often when walking down the streets of New York where you hear rather peculiar things sometimes What Is Poetry The medieval town, with frieze of boy scouts from Nagoya? The snow that came when we wanted it to snow? Beautiful images? Trying to avoid ideas as in this poem? But we go back to them as to a wife, leaving the mistress we desire? Now they will have to believe it as we believe it. In school all the thought got combed out. What was left was like a field Shut your eyes, and you can feel it for miles around. Now open them on a thin, vertical path It might give us, what, ((s-)) some flowers soon It's= it's the last line It might give us, what, some flowers soon, that I overheard a boy saying to a girl in  Brentano's Bookshop in New York and decided to keep it. (({breath})) uh The next one uh At North Farm was written in uh the early eighties and although North Farm obviously could be anywhere and I don't explain in the poem ((wha-)) what suggested it It was # it's actually the name given in a translation I read of the Kalevala, the Finnish folk epic of placed called # I think it # Pohjola. I don't know how the Finnish pronunciation # place described as being near hell but not exactly in it and always with the epithet, {NSV} Looming and Prosperous North Farm At North Farm Somewhere someone is traveling furiously toward you, at incredible speed, traveling day and night, Through blizzards and desert heat, Across torrents, through narrow passes. But will he know where to find you recognize you when he sees you, Give you the thing he has for you? Hardly anything grows here, Yet the granaries are bursting with meal, the sacks of meal piled to the rafters. The streams run with sweetness, fattening fish. Birds darken the sky. Is it enough that the dish of milk is set out at night, that we think of him sometimes, sometimes and always, with mixed feelings? Well, this is a fairly recent poem of the past few years. Don't know exactly when Called At First I Thought I Wouldn't Say Anything About It (({NSV})) and uh I can't think of anything I was thinking about when I wrote it, so I won't (({NSV})) introduce it except uh I see it has the phrase, The unruly sun, obviously a uh theft from John Dunne. At first I thought I wouldn't say anything about it But then I thought keeping quiet about it might appear even ruder At first I thought I had died and gone to heaven But that scapegrace the unruly son informed me otherwise I'm in my heavyset pants, and find this occupation of beekeeper charming thought I have yet to meet my first bee We don't know if I get to keep the hat and veil Too hot, he said, Too hot for everything, he so caring, so mundane to have you onboard Bulgarian choirs everywhere stood up and sang the song of the rent. It was lovely Now, I shall take a short vacation, ((proof)) that I am needed here Nobody wants my two cents anymore, I believe To some it was like skating in summer a small turret perched over the lake. It exploded That's the way I feel about people taking me out to some nice repast and afterwards you go home and go over everything that was stated I prefer flowers and breathing. The next poem is called No Longer Very Clear and uh well it's no longer very clear to me when I wrote it or what I was thinking about when I wrote it. However I= uh I could tell you that the public radio station in= um in New York City, ~WNYC had a uh benefit uh concert and they asked me to contribute a poem ((uh)) which would be set to music by a number of contemporary composers, or at any rate they would write music suggested by it if they weren't actually setting the words. And uh Philip Glass uh Morton Gould, Tania Leon were among the uh composers and one of them was uh the composer Joan Tower who is actually a= a friend of mine and= and colleague at Bard College where she teaches and ((uh)) she took two of the lines and uh wrote piano pieces that she says are based on and then she's going to do another one to make three, but she hasn't done it yet	Subject	
