file	beg	end	text	speaker	section
Bromige-David_Complete-Recording_Cal-Tech_3-7-72	1.73	455.193	I thought to go to Chicago right away and suddenly, inexplicably, my will failed me. Was it that I'd gotten so accustomed to living all by myself during the past four months? That I needed no one else? An older woman, a second cousin, took me in hand, but I was able to keep my detachment by seeing that it was only my mental image of her that was making love to me. Whatever our ((bodies)) were up to. Meanwhile, I kept a close watch on that ladder activity, thinking how now I would be able to satisfy Hilda when next we met. The knowledge, however acquired, is power. I must confess my feelings towards Hilda were not unmixed. At times I would decide to banish her ((for)) she deserved nothing else. But then I would see that she was already banished, and that I would have to think of something else. Well, the first thing I had to confront was how to extricate myself from the second cousin's clutches. That's another story. A story all in itself and one, really, very much like this. So I don't have to tell it here. A year had passed and Hilda had grown some four or five inches so that she was now six feet tall. Her wrists, which had been ((long)) with a kind of vulnerability I found very attractive, were now bony as though she'd been hung from a beam. Her face, deprived of its previous bloom, was long and sallow. In short, I thought her ugly. Pitifully so, although when she spoke the voice was the same and I was glad to feel the pain of that survival. Her place was by no means the palace she had caused me to infer she came from. I had to spend the night on a couch in the living room but by now I knew this kind of evasion of the realities of one's circumstance was widespread and I'd even begun to slip into it myself. Next day when her parents were at work, Hilda, who had taken the morning off, sat with me in the kitchen while her boyfriend raced his motorbike up and down the block, looking up at the window from time to time, sneakily. I caught his glance once when I was looking down. How Hilda must have felt. She had returned to a different perspective, and now here I was, the living proof of a will she wouldn't be likely to meet many more times in the corner she had settled for. For it was clear to me now that all was over between us. Listening to her talk I began to despise the person I had been the year before. Still, I had the will to stay, but the will to leave under those circumstances offered more possibilities and so I bowed gracefully to the inevitable. When I got up to go, tears did come to her eyes. That moment I remember still and I recognized immediately a feeling to be stored up against the ease, if not the indifference, of times to come. Many times in the future I was to conjure that farewell when I was filled with despair and often it sufficed to tip the balance so that it could be thought to have caused several destructive rages over the years. But it's all water under the bridge now. Hardly worth the trouble of telling and it's past time already to think that I have told it poorly and to see that, like it or not, there's nothing I can do about that either. Yes, it might have all been otherwise and yet for what it has to say about the human will in one of its manifestations, I wouldn't change one moment of the misery. For an easier way is not necessarily a better. and I believe I can speak not only for myself, but for Hilda, who found out what it was like to meet her match. A man who scorned to take either no or yes for an answer. ((Okay.)) Now th- these are a series of short pieces with a general title of tight corners {cough} Have I been reading about twenty five minutes? Feels like it. What's the time? Yeah I have Okay. I'll= read= I'll read for about ten minutes more. The boy, elbows bent, supports himself with his hands. His body prone so that his face may approach the surface of this small pond from which he drinks. At his back the lane goes on and the sheep go with it. The black dog at their back, possibly a reminder of the artist or one's self. Further on, one wants to say, though in another sense it's higher up, the lane crooks out of the shade and finds an open meadow from where there must be a better view of that squat church tower. But the clouds, the clouds are more surely the point. Such clouds as are no longer to be seen. A rhythm of contraction would pull one in, deeper into itself, before that open space. Meadow and sky is granted one. These are very loosely sequential and uh it's= it's happiest for me if I just uh make up a different way through it each time. So. The pause is only while ((the eye selects)) something to do. While they watch the cat, while they watch (({laugh})) While they watch, the cat stalks up the path to the front door, raises itself by putting its front paws as high as it can reach against the door and then, resting on its left forefoot, it raises its right so that the knocker is moved out until the arc of the paw falls below the arc the knocker makes and thus the knocker falls back against the metal inset in the door and as they watch, the door opens and the cat slips in as a woman's face appears peering into the street. The two men have been walking for a long time, one thinks though perhaps no more than an hour. It's now becoming obvious that he has chosen the less traveled of two highways out of town in the direction he and his friend want to go. His friend was right, and he was wrong. They resolve to take the cutoff they are now approaching, and to walk its length, if no farm truck comes along, until the other highway is reached. The heat is considerable. It is early afternoon. On either hand huge fields of wheat find no wind to stir them. The only food they have is a chocolate bar. The time comes to eat it, and one unslings the pack and they take it out.	Speaker1	
Bromige-David_Complete-Recording_New-Poems_Unknown-Reel	0.122	547.339	When the bunk shook so hard stuff fell from the ceiling he saw whose hand it was. But the woman had pulled him so strongly into her front that a button of her dress had dug in his cheek above the bone and that pain took over. But= after= that= but after that, he saw the hand often, looking where it was cut through just like the meat in the butcher's. There was something he wanted to do with it. He picked it up and felt it from outside and then from in as though he wore it on his wrist like his own hands. He still searched for the jagged metals, but now his father had told him where it came from. He treasured particularly those pieces molded like a screw. You save them up, hoping he'd one day have all the pieces and be able to put them together like a jigsaw puzzle and build a shell of his own. Would it be mine? He asked the father, or the governments? His father told him his, if he kept it hidden. So there was that to think about. He could go out looking in the gutters when the sounds came late at night. I want to start with a book with ((poems)). My first book which came out in nineteen sixty five called The Gathering. That's the name of the book. The poem is called we could get a drink. Sunday morning, lying in, complacencies of the newly wed. Out the window the slender, sun silver trees lead me back to Hampstead Heath where I run again Down sparse grass banks by clumps of gorse. Below silver trees I try to tell you but end up we could get a drink on a Sunday, anyway. You laugh, move closer under the covers. Our silver limbs stir in the gloom like cutthroat trout I saw in a lake a hundred miles out of Vancouver hiding their strike in shadow. The mind a fish, shifting fragilely its position when the body's easy, a still pool. Now eddies in a scene from a documentary seen months back. Girl, eyes like yours, girl, slung over a Tommy's shoulder. Mouth open, but nothing said until the commentator, as the camera pans past the black patch I don't watch because my eye hooks on the hatrack hips. Says starved to death, the soldier throws her into a pit. That's a tangle of white. Very slender limbs. Went sliding down the crater's muddy slide. The instant I called there's a bomb fell here last night. Let's look at the crater. Went running over the Heath, laughing, my friends alone running. Down to today when looking at silver birch I say nothing at all but we could get a drink there. Move closer beneath the blanket, while the cutthroat flick under their bank. This next poem is issued as a book called Please, Like Me. It was put out by Black Sparrow Press in Los Angeles this year. Strolling through the town, all the houses quiet at this hour, the street already hot, hold women. The leader of our magazine crew knew how to gain entrance by knowing that door opening before the act the door opening. The woman, with him, his packet already hung on the back of a chair, his shirt coming off, crossed to the window to pull the shade making it night. But in the morning, unknowing, despite the look she gave him, and me, watching mentioned her husband who handled such matters, her hands at the necklace, her throat was naked of. Compliant women, my expression insisted equally, turn me away, and they would. A snapshot one of them took, as I lugged up my arm to knock, faded, falls from my wallet as I count my take from last night, another subscription sold, working late, to think. Great weight brought to bear on a door flies open at your first touch. Your momentum pitches you sickeningly into the vacuum cleaner, parked in the narrow hall, the muscles involved with nothing to parry ache, a nagging sense of something far from being right. A wrench in the very socket of the self. A disarming tenderness, as if, on the instant, I stopped now, knocked here, went in, found rose lamps lit indistinctly for the sun that floods the room. The brakes, the skid begun, surface slick with the summer shower, he jammed. The chevy's tires, nothing to grip on slid the four of us within inches of the poem's abruption. Welcome. And again, welcome. Make yourself to home. Drove nails into the plaster that wouldn't support even a picture, hardly a heavy piece. Chiaroscuro print cut with a knife from a library book because I, against all claims of social conscience, against all readers whose thighs tomorrow would push against the metal crosspiece of the turnstile, wanted it. The blood floods the shaft. Half moon focus in an enormity of sky extends by fractions limits. The blood continuously feeds, skin, sinew, ligaments wherein, a heaviness of pleasure. Posit night, and it is night, a white flashlight conjures a white door. A red calls forth a red. With which your can't come in, she shouts. But that's no use. I want. All right, you son of a bitch, you bluffer. Even though the sentiment itself be but a bluff, I'll call you. But useless again, if the man on the path must tell her what to say. She switches on her porch light and the day goes, that kind of light by which the face that passed, translucent skin, nose freckled at what bridge it had, the eyes prominent enough so light could be seen to pass through the pupil nonetheless left dark, but liquid dark, the bones of the cheek and chin so clean.	Subject	
Bromige-David_Complete-Recording_With-Ron-Loewinsohn_SF_1-29-64	1.978	434.413	At other times fans in the stands get a souvenir arguing as they were a minute previous among themselves Putting money on the next pitch at eight to five, turning suddenly and raising the hands to grab the home run ball, still warm from the pitcher's hand and turning as fluidly to collect his bet, adjusting his cap It's very distinct at the ballpark the players play ball, the umpires arbitrate, the groundskeepers manicure the grounds, watering the base paths with grave, silk like movements They're all regally ignorant+ of the spectators watching, among other things {cough}, their actions, their efforts, their cheers, their jeers fall on deaf ears The young Dominican pitcher surveys his outfield, vibrant green under the lights Este es mi parque The cheers of the patron rain # the cheers of the patrons rain down on his deaf ears At the ball park, it's all very distinct {cough} This one is called Vision of Childhood. The rain tonight on the mountain outside my window on the street on the freeways of California on the farms in the Livermore Valley raining tonight in Placerville where my wife's father was born The black water on the mountain here five hundred yards beyond my window The water cutting its own sluices in the soil of California I forget what I was talking to him about in the dream, my son the age of three, about the people who'd come to California in the past in forty nine They sailed in wooden ships around the horn or walked beside their oxen across the Sierras all that energy spent Some vision, some ((getting)) whether it was the gold that got them here or the soil or even the weather, which even today the magazines extoll, Our Soon to Be Biggest State The governor in his press releases, his census estimates the streamings over the borders of California, the several chambers of commerce, a perfect environment for all ages from the cradle to the grave And he said, But I didn't come around the horn His mother, an advertising copywriter whom I divorced, had just returned with him from New York I came through the canal Why, of course. It seemed in the dream obvious to me, knowing the anatomy of America Someone was ironing a work shirt for me in the hallway outside that room And then the letter from his mother. He was sitting at breakfast, playing with ten bright, shiny, new pennies all lined up in a row, all the Lincoln heads up, all looking the same way He straightened up, looked all the Lincolns in the eye and said, Okay you guys. Smile. This one is uh # ((yeah,)) I hope he's not here. This one is a- {cough} is about a barber that I used to go to ((had)) my hair cut uh pretty regularly uh on= uh on the bottom end of Columbus Avenue. And it's called The Fortunate Barber The fortunate barber hones his razor He says he remembers back to Prohibition ((Elder)) the barber tells about the horrors Oh, those corpses, those Barbary Coast days At his age, his white hair, the red bangs of his face, sex and liquor seemed to be his main concerns This friend of mine's window faced the hospital, these two nurses giving it to= ea- to each other with a rubber cock Sex and liquor fill his talk his Sundays with his married daughter in Walnut Creek, her kids Beatniks, queers, foreign cars, those track stars, Willie Mays, they're all Black, those fucking shines The red cheeks of his granddaughter, his Irish week, his nights in front of the TV His wife wakes him when he falls asleep and they turn off the set and go to bed Almost every time, there's someone I cut his hair last week. Next thing I hear, he took a heart attack One brother's dead an alcoholic who fell down once and bled all over Elmer's car Barber's eyes that day A second brother's ((hassled)) with the ~V ~A. I saw that one shuffle out of a place one afternoon The fortunate barber reads the newspaper. He stands in his doorway He watches me go by The back of my neck, the hair around my ears from day to day The travel agent next door's another customer, and most of the cops back and forth from Central Station We walk by the shops throughout the week and he looks at the backs of our necks and our ears out there abroad in the ((May streets)) {cough} This one's called Flowers, because they've come to be Late blooming marigolds, nasturtiums daisies yawning on a Sunday morning in the sunlight ((hits)) October We woke up this morning and they started putting the world together. The sunlight on the wall, in your hair, your eyes blinking, the air outside my window Nasturtiums, chrysanthemums, late blooming marigold, daisies yawning on a Sunday morning You've entered this poem You're leaning against the doorjamb. You've taken off your shoes The abstractions fall away like shoes, lying there by the door to my kitchen You walk over to the window where I'm looking down at the house across the street the colors of their roofs Late blooming marigolds, daisies yawning on a Sunday morning in the sunlight, the rooftop, the tar flower, the shingled bloom, the tile ((burgeoning+)) It's October We woke up this morning and they started putting the world together that fog to the north hiding what hasn't been made yet {cough} By ((this)) afternoon, ((aquatic)) cartwheel has been created	Subject	
Brown-Lee-Ann_Complete-Reading_Tender-Buttons-Press_UPenn_10-21-03	0.244	370.548	My mother was impressed with my articulation and that I could speak at all, much less make poetic conceptualizations about your birthday. In fact, I was obsessing on what would be in the big birthday book. You almost made the day of eccentricity along with (()), but you pass that over for the day of abandon, total freedom. Same sign as Sinead O'Connor, Mary Queen of Scots, Jim Morrison, Flip Wilson, alter ego, Geraldine, whom your grandmother of the same name was purpor- purported to have loved and others of wild nature unable to be contained. You were also born in the year of the horse and as a Sagittarius, you are a double horsey ready to run and  travel free. But I hope you'll stick close by me for a while because I love it. And even though last month, you're supposedly finally figured out we are separate bodies and identities, you were own self from the beginning of focused, discerning light, so calm for a baby. You did cry, though not as often as most we hear and you did not have that collar or colic, but any of the # but are of the undeniably sweet dis- disposition. Anyway, as I was saying, I love you close by me. And when we= we are together in bed, you nursing in the crook of my arm, I can imagine you are still attached to me as you were in the inside and your fine smooth body, exceptionally fat, fair and pure is covered with fine patina of sweat. It is like you are still swimming in me. One time when you were kicking up a storm so strong in Vienna when I was walking one night to catch the tram to meet your father, you kicked such a complex rhythm that I had to stop walking in order to process the polyphony. I noticed these couplets line are growing longer and longer. It's because I have so much to say to you and the headlong rush seems the way to go if I am to attempt to catch up in all the varied strands of thought and experience that have transpired since your birth, making everything richer and more layered. I even had the feeling yesterday that you had always been here, even though you've only been outside a little over half a year. Maybe you were always there in eternity or infinity. You met destiny on the street the other day and I said destiny, meet reality and reality, meet destiny. And Destiny's mother laughed and told her friend how I looked around when she was calling out down Eighth Avenue. Destiny. Destiny. So many little happenings since you were born. And before now that art and life seem even more enmeshed. I think I'll go take a swim with you and your dad now in the ~L shaped pool with you and your bright pink swim diapers given to us unused by Stella. So many lovely hand me downs and new things too. (({laugh})). Had to work up to that one. ((I)) # I'll= just= I'll just do like a few from this. And um uh India's going to read some of the three fifteen project that she worked on. I wanted to read um a piece of mine. It's= a= it's an interesting um project that # Bernadette Mayer is another ins- inspiration to= to us that um ((Laney)) referenced earlier. And she's also a way that Stein comes into this generation. She taught us a lot about um Gertrude Stein's sort of conceptual um you know, ideas with the sentence and her play. um But the # this definitions of the # the three fifteen project is a bunch of people writing every August at three fifteen in the morning. And it's going on for like, what, eight years or so? Eight, ten years. I did it the very first year. I think it was ninety three, or something like that. um So if you ever want to join it, there's a website I think you can join up to do the three fifteen project. But I # this is the only thing I saved from this book out of that. And then the whole thing was published in their place, but um this is definitions at three fifteen. Poetry, a condensed form of food and time. Voice, my speech, babe. Brain, a rain in ((~B)). Boat, ((toy bot, a ted debt)). Solitude, sun in a squeegee. Modesty, the ruined package. Discourse, talking fancy without much= much to drink. And I'll just do um very short sample from this new book. um Oh, before I forget, the Tinder Buttons books that are here tonight, um India's and Laney's, I ((wanted)) you know, if you want to pick them up or get # give a special deal tonight. So please, um usually like eleven ninety five, we'll give two for ten bucks or seven each if you want just one. So, um want to say that before I forget {laugh}. Because we have uh # we brought them down from New York when you had to take them home with you and put them on your bedside. Another thing I like about um um you know, Laney's work is the um work with the botanical language. The= the language of flowers and= and of seeds and botany and science. And I= I did a lot of work with that. And then, um of course I was attracted to India's um work with sleep as a sort of transformative state. um And (()) # we both use those in our works. So I think that's one of the common threads and I want to read two poems that sort of link up with that. So um Encyclopedia Botanica. Or # this is sort of a title of my book # or a mother to be's book of meltdown, anticipation, and scientific renderings of organic and theoretical forms such as the way flowers lie in the bud. A permutational (()) of (()), consisting of painful insufflations, multiple (()). The calculus of various inflorescence. My nave set theories as unordered pairs, vibratory odes in all manner of cross pollinating color, illumined spores and how they grow in corkscrew contortion  all imbued with entire new electric libraries of the body. Herein find random factors of the strange attraction to hard science, but also to soften it. Previously failed materials and pick up works. Illuminated maps of misreading. Specifically a trace study of my own peculiar vocabulary living in the dictionary.	Subject	
